{
  "plan_version": "1.0.0",
  "kind": "unary",
  "key": "demo.users.find_user",
  "rpc_path": "/v1/rpc",
  "serial_strategy": "json",
  "headers": {
    "authorization": "[redacted]",
    "accept": "application/json"
  },
  "proxy_url": "http://redacted@proxy.internal:8080",
  "query": {
    "access_token": "[redacted]",
    "api-key": "[redacted]",
    "page": 2
  }
}
